Nid,Title,Summary,Body,field_new_image,Path,Post date,langcode
102,NACHA Study Reveals Donors Who Use Direct Withdrawal via ACH Gave More Than Double in a 12-Month Period Compared to Those Using Other Payment Types ,"
	Research confirms that direct withdrawal via ACH as a giving method more fully supports nonprofit goals and objectives by retaining and cultivating sustaining donors.
","
	 

	Research confirms that direct withdrawal via ACH as a giving method more fully supports nonprofit goals and objectives by retaining and cultivating sustaining donors

	DOWNLOAD RESEARCH

	HERNDON, Va., Oct. 31, 2017 – NACHA—The Electronic Payments Association® today announced the results of two recent studies that explore the role that direct withdrawal via ACH plays in nonprofit donations. The findings conclude that using ACH leads to more frequent and higher dollar contributions from sustaining donors.

	The first study, conducted by ConsumerQuest, evaluated the ways in which people donate, and explored the impact of sustaining donations. The study found that sustaining donors make up the bulk of a nonprofit’s donation income, with 67 percent of organizational donations originating from a person who has given for at least the last three years. The research also demonstrated that direct withdrawal via ACH increases the likelihood of a recurring donation as ACH donors authorize automatically executed donations according to a set schedule (71 percent) versus those using other payment types (9 percent).

	“Direct withdrawal via ACH is the gold standard for recurring payments, such as monthly bills,” says Priscilla Holland, senior director, healthcare and industry verticals, NACHA. “This new research now shows that the same is true in nonprofit giving. Direct withdrawal serves as the foundation on which to build a sustaining donor program.”

	In addition to looking at recurring donations, the study uncovered other advantages of direct withdrawal via ACH, revealing ACH donors give more often, and in higher volume and value, than other donors, specifically:

		ACH donors give more than double ($1,700 versus $650) in a 12-month period than those using paper check, credit/debit card, or other means.

		ACH donors make an average of 8.2 donations compared to 3.5 donations by those who use other payment types in a 12-month period.

	“The findings from the survey align with our own donor experience,” says Jennifer Halm, director of membership, Capital Public Radio in Sacramento, California, a nonprofit organization featured in a NACHA case study. “Seventy-nine percent of our sustaining donors now pay with ACH. They are responsible for more than 43 percent of all individual donation dollars, and we retain new ACH sustainers at an 18 percent higher rate than new sustainers who use credit or debit cards.”

	The study also found that credit/debit card account information often changes for donors, potentially causing an administrative headache for nonprofits. Specifically:

		55 percent of respondents had a credit/debit card reissued in the past year because it had expired or because there was a security concern.

		38 percent of all the credit/debit cards used by respondents were reissued at least once during the past year.

	“Direct withdrawal via ACH payments don’t have the challenges with credit card expiration dates or cancelled cards,” Holland said. “Further, ACH payments are more cost effective for nonprofits than donations made via cards, allowing more of the donation dollars to be directed to the mission of nonprofits instead of processing fees.”

	A second study conducted by ConsumerQuest provided findings to support nonprofits in assessing the donor messages that will resonate in building direct withdrawal via ACH programs. The most convincing single message centered on helping nonprofits maximize resources. The statement, “Donations made via direct withdrawal are more cost-effective for your nonprofit,” rose to the top as a reason for donors to choose ACH payments as their donation method.

	The research is available for download on electronicpayments.org. Additionally, both NACHA and Capital Public Radio expand on these findings, as well as discuss specific program results and best practices for using direct withdrawal via ACH in sustaining donor programs in a presentation, “Building Your Nonprofit’s Sustaining Donor Program with ACH.”  The complimentary webinar recording and PowerPoint presentation are available for download here: https://nacha.adobeconnect.com/ph9jzr42c8hl/. 

	In addition to these resources, NACHA offers a complete nonprofit toolkit, consisting of a case study, checklist, best practices, and more, to support nonprofits in growing sustaining donor programs with direct withdrawal via ACH. These and other tools are available at electronicpayments.org/donor. 

	About NACHA—The Electronic Payments Association

	NACHA—The Electronic Payments Association is the steward of the ACH Network – one of the largest, safest and most reliable payment systems in the world. The ACH Network creates value and enables innovation by universally connecting all U.S. financial institutions, and moving money and information directly from one bank account to another. In 2016, there were 25 billion ACH payments made that moved $43 trillion. NACHA also brings together diverse organizations to develop rules and standards to benefit payments ecosystem participants, including Electronic Benefits Transfer (EBT) and healthcare Electronic Funds Transfer (EFT). By collaborating with other standards organizations and geographies, NACHA facilitates compatibility and integration with U.S. payments. Visit nacha.org for more information.
",,/news/nacha-study-reveals-donors-who-use-direct-withdrawal-ach-gave-more-double-12-month-period,"Tuesday, October 31, 2017 - 10:43",en
100,Complimentary Webinar: Building Your Nonprofit’s Sustaining Donor Program with ACH - Oct. 4,"
	Just in time for the year-end giving season, join NACHA on Wednesday, Oct. 4, at 2 p.m. EST for an impactful webinar on how nonprofits of all types and sizes can leverage direct withdrawal via ACH to develop and grow sustaining donors.
","
	Wednesday, Oct. 4, 2 p.m. - 3 p.m. Eastern Time

	Just in time for the year-end giving season, join NACHA—The Electronic Payments Association for an impactful webinar on how nonprofits of all types and sizes can leverage direct withdrawal via ACH to develop and grow sustaining donors. 

		Chief Development Officers and donor relations professionals know that sustaining donors create a reliable income flow for their nonprofit organizations.

		Direct withdrawal via ACH helps retain donors and cultivate recurring donors.

		It also reduces costs – allowing your donors’ resources to more fully support your mission.

	Attend this webinar to learn how ACH payments can help your nonprofit start or grow a sustaining donor program in time for year-end donations and to prepare for a successful 2018 and beyond.

	REGISTER TODAY

	Speakers will:

		identify specific steps to establish a sustaining donor program with ACH;

		detail best practices for delivering increased sustaining donations for nonprofits;

		share key research findings about how ACH donations are more beneficial to nonprofits than credit cards or checks;

		share a case study showcasing how a nonprofit was able to grow sustaining donors via ACH to 75 percent of their total sustaining dollars. This represents more than 40 percent of the individual donation dollars to the organization. 

	SPEAKERS:

	Priscilla HollandSenior Director, Healthcare & Industry Verticals, NACHA

	​Jennifer HalmDirector of Membership, Capital Public Radio

	MODERATOR:
	Peter HohensteinSenior Director, ACH Network Administration, NACHA

	THIS EVENT QUALIFIES FOR AAP CREDIT.

	COST: Complimentary
",,/news/complimentary-webinar-building-your-nonprofit%E2%80%99s-sustaining-donor-program-ach-oct-4,"Monday, August 21, 2017 - 14:47",en
97,The Month of May is the Perfect Opportunity to Increase Savings and Build Wealth through Direct Deposit and Split Deposit,"
	NACHA encourages workers to use the electronic deposit of payroll to automate their savings
","
	NACHA encourages workers to use the electronic deposit of payroll to automate their savings

	The problem is clear. Workers are not saving enough for their future nor to cover emergencies that may crop up. In fact, the average personal saving rate – the amount of disposable income put towards saving – hovers around 6 percent, which is far too low.[1] Further, 46 percent of U.S. households do not have $400 readily available to cover an emergency expense.[2]

	
	Yet, the solution is simple. In recognition of Direct Deposit and Direct Payment via ACH Month, which is celebrated annually in May, NACHA—The Electronic Payments Association® continues to promote the value of Direct Deposit and Split Deposit, and how these tools can help increase personal savings and build wealth. 

	“People are not saving. And, worse, they may falsely conclude that they do not earn enough to save regularly,” said Scott M. Lang, AAP, Senior Vice President, Association Services at NACHA. “But there is a way to save automatically that is also simple, safe and flexible.

	“Splitting their Direct Deposit offers workers an effective way to regularly put aside a fixed amount or percentage of their pay automatically and directly into savings and investment accounts for emergencies, planned expenses or retirement,” Lang said. “The importance of automatic savings for workers’ long-term financial future cannot be overstated.”

	According to a recent study conducted by Javelin Strategy and Research, 82 percent of U.S. workers ─ crossing age, income and other demographic categories ─ receive their regular pay using Direct Deposit via ACH. Yet only 24 percent split their deposits, typically placing their pay in a checking account and also designating a portion of funds to go to a savings account, 401(k), a business account, money market or to a prepaid card.
	 
	Of Split Deposit users, 85 percent say it is helping them to save, and 83 percent say the most common use for Split Deposits is for an emergency fund, according to the survey.
	 
	For more information about Direct Deposit, Split Deposit, and saving automatically, visit ElectronicPayments.org. A toolkit of shareable resources to help celebrate Direct Deposit and Direct Payment via ACH Month is also available.
	 
	Additionally, in February, NACHA and partner organizations America Saves and ePayResources launched the “Split to Save” initiative to engage businesses, consumer organizations, financial institutions, government agencies and universities, and help them support the financial health of workers. A “Split to Save” toolkit, which provides educational resources for building awareness about Direct Deposit and Split Deposit, is available for download.
	 
	---

	[1] Bureau of Economic Analysis, U.S. Department of Commerce, www.bea.gov/newsreleases/national/pi/pinewsrelease.htm.

	[2] Federal Reserve, “Report on the Economic Well-Being of U.S. Households in 2015.""

	(link is external)
",,/news/month-may-perfect-opportunity-increase-savings-and-build-wealth-through-direct-deposit-and,"Thursday, May 18, 2017 - 16:34",en
91,NACHA Debuts Nonprofit Toolkit to Support Sustaining Donor Programs,"
	NACHA today debuted its nonprofit toolkit, designed to help nonprofits grow their sustaining donor programs with Direct Payment via ACH. 
","
	Research points to opportunity for ACH payments to increase donor retention

	NACHA debuted its nonprofit toolkit, designed to help nonprofits grow their sustaining donor programs. The toolkit offers practical tips and resources for leveraging direct withdrawal via ACH – a form of Direct Payment via ACH - to retain donors and sustain contributions. 

	The new nonprofit toolkit, available on electronicpayments.org, consists of four core pieces: 
	1.    Case Study – Featuring Capital Public Radio’s “Evergreen” campaign, this case study provides a concrete example of how ACH payments increase donor contributions and retention. The station reports ACH payments are responsible for more than 40 percent of all individual donation dollars, and they retain ACH donors up to 20 percent longer than those using credit cards. 
	2.    Checklist – Identifying specific steps, this checklist simplifies the process of establishing a sustaining donor program with ACH. 
	3.    Best Practices – Once established, nonprofits can enhance and grow their sustaining donor programs by increasing ACH payments. This document outlines tried-and-true practices that deliver increased sustainer donations for nonprofits. 
	4.    Addressing Common Misconceptions – This promotional piece directly addresses and responds to common misconceptions about ACH payments, enabling nonprofits to offer factual responses to donors who may have questions.  

	“ACH payments are the gold standard for recurring payments, and nonprofits rely on recurring donations,” said Priscilla Holland, Senior Director, Healthcare & Industry Verticals, NACHA. “We designed the toolkit to help support the set up and promotion of direct withdrawal via ACH for sustaining donor programs that ultimately will help the nonprofits achieve their program goals.” 

	Research demonstrates that ACH payments can improve donor retention. According to early findings from a study commissioned by NACHA, donors who give via ACH donate more frequently than those who donate via other means. One major reason is because donors who use direct withdrawal via ACH can set up their donations to continue automatically until canceled by the donor. In addition to giving more often, direct withdrawal via ACH donors give more, donating more than double compared to donors who give via paper check, credit card or other means. 

	The research also shows that direct withdrawal via ACH is a payment method donors want to use. Donors cited “familiarity and comfort” and “quick and easy” as the most important factors when choosing their method of payment. Additionally, donors indicated that “the charity receives the donation quickly” and “the method is trustworthy” as additional factors when considering a donation method. 

	“Currently 82 percent of U.S. workers receive their pay via ACH – commonly known as Direct Deposit – and consumers pay more than 800 bills each month via ACH,” said Holland “Additionally, ACH payments are fast and easy. They can be set up online just as quickly as any other type of payment, and most payments can be received by an organization the next day. ACH transactions are safe and have the least incidence of fraud compared to other payment types.  Clearly, ACH payments meet the needs and wants of donors.”

	The new content launched today adds to other resources available to nonprofits. For more information on ACH payments or to download the nonprofit toolkit, visit electronicpayments.org. 
",,/news/nacha-debuts-nonprofit-toolkit-support-sustaining-donor-programs,"Thursday, April 27, 2017 - 11:19",en
87,"NACHA Releases Case Study Featuring Capital Public Radio, which Uses Direct Payment via ACH to Retain Donors 20 Percent Longer","
	

	NACHA Launches New Effort to Build Use of ACH Payments to Grow and Retain Donors
","
	

	NACHA Launches New Effort to Build Use of ACH Payments to Grow and Retain Donors

	NACHA released a case study on the benefits of using Direct Payment via ACH for donor retention and announced the launch of a new comprehensive outreach effort. The effort is designed to increase awareness and understanding of the value of ACH payments for fundraising, and build confidence in adoption and use of these payments by charitable organizations to grow and sustain donation dollars and their donor base over time.
	 
	“Industry research clearly shows that the contributions of sustaining donors, or those that give on a recurring basis, are worth more than those from traditional donors over the life of their giving,” said Janet O. Estep, NACHA president and CEO. “In addition to donating more frequently and at higher amounts than traditional givers, sustainers continue to give for many years providing for consistent and predictable cash flows and a loyal and committed donor base. Organizations that leverage Direct Payment via ACH for sustained giving can reduce resources spent on fundraising and devote more effort to what matters most: their missions.”
	 
	NACHA’s newest case study highlights the value of Direct Payment via ACH for donation collection. The case study features Capital Public Radio (CapRadio), which is based in Sacramento, Calif., and showcases how it leverages ACH for its sustaining donor program. According to CapRadio, sustaining donors that pay with ACH are responsible for more than 40 percent of all individual donation dollars, and they are retained for up to 20 percent longer than sustainers who use credit or debit cards.
	 
	Recurring Direct Payment via ACH results in less churn among donors because consumers’ bank accounts don’t have expiration dates, and consumer are far less likely to change their main bank accounts than they are with credit cards. Further, recurring ACH payments are just as easy to set up online as any other type of payment. Recurring ACH payments have been the preferred payment method for decades for other types of organizations, such as billing companies for recurring bill payments, and employers of all types and sizes for payroll Direct Deposit.
	 
	“ACH payments can be a powerful tool for charitable organizations of all sizes and types,” said Estep. “It is our hope to enhance awareness and understanding of this payment method as it will go a long way in advancing the invaluable work of our nation’s charitable organizations.”
	 
	To support the launch of the effort and release of the case study, NACHA will be speaking and exhibiting at a variety of events in 2017 including:

		PAYMENTS 2017, Austin, Texas, April 23-26

		AFP International Fundraising Conference (link is external), San Francisco, Calif., April 30 - May 2 

	Additionally, NACHA will be finalizing a number of nonprofit research efforts around donation trends and donor communications, and continuing the development and promotion of resources to support organizations with understanding and adoption of ACH payments. NACHA will continue to release research and new resources as they are developed and finalized to support the nonprofit engagement effort.
	 
	Nonprofits and charitable organizations can find currently available resources on ACH payments by visiting www.electronicpayments.org (link is external).    
",,/news/nacha-releases-case-study-featuring-capital-public-radio-which-uses-direct-payment-ach-retain,"Friday, February 24, 2017 - 10:00",en
86,"""Split to Save” Campaign Launches to Encourage American Workers to Increase Savings and Build Wealth through Split Deposit ","
	NACHA and partner organizations will host webinar, highlight the value of Split Deposit during America Saves Week, Feb. 27 - March 4, through Direct Deposit and Direct Payment via ACH Month in May  
","
	NACHA and partner organizations will host webinar, highlight the value of Split Deposit during America Saves Week, Feb. 27 - March 4, through Direct Deposit and Direct Payment via ACH Month in May  

	HERNDON, Va., Feb. 16, 2017 – NACHA—The Electronic Payments Association®, America Saves, and ePayResources™ have joined forces through the “Split to Save” campaign to educate workers on the benefits of Direct Deposit via ACH and Split Deposit, and how these tools can help increase personal savings and build wealth.  
	Direct Deposit provides for the electronic deposit of payroll and also enables Split Deposit, the ability to automatically direct a fixed percentage or dollar amount of pay into a savings or investment account. Currently, 82 percent of the nation’s workers receive Direct Deposit of their pay, but only 24 percent use Split Deposit - one of the easiest ways to grow savings over time. 
	“Split Deposit is simple, safe, flexible and smart. Yet despite its proven financial benefits, many of our nation’s workers are not taking advantage of this free tool,” said Scott M. Lang, AAP, Senior Vice President, Association Services at NACHA. “To help individuals more fully realize these benefits, we encourage businesses, financial institutions, consumer organizations and others to promote Split Deposit as a way to automatically grow savings.”  
	NACHA and its partner organizations will highlight the value of Split Deposit during America Saves Week, Feb. 27-March 4, through Direct Deposit and Direct Payment via ACH Month in May. A free webinar to kick off the campaign will be held on Feb. 23 at 2 p.m. EST. Speakers from partner organizations will share an overview of the campaign, information and research data on the value of Direct Deposit and Split Deposit to businesses and workers, and the benefits of joining Split to Save as a partner.  
	Speakers also will unveil the “Split to Save” Toolkit, which will provide educational resources for building awareness about Direct Deposit and Split Deposit. Registration for the webinar is available at https://electronicpayments.nacha.org/news/webinar-split-save-campaign-kickoff.  
	“We are inviting financial institutions, employers and others to partner with ‘Split to Save’ so they can better inform their consumer customers and employees about the value of automating their savings through Direct Deposit and Split Deposit,” said George Barany, Director of Strategic Initiatives for America Saves.

	“Americans are not saving enough for their future. It is good for the consumer and it is good for society if we can introduce more people to saving automatically,” said Steve Vaglio, AAP, Executive Vice President of Marketing and Communications for ePayResources. “We want every worker to build their savings and long-term wealth by starting or growing a savings account with Split Deposit today.”  
	For more resources on Split Deposit, Direct Deposit, and saving automatically, visit ElectronicPayments.org. To learn more about America Saves Week, visit www.americasavesweek.org.

	About NACHA—The Electronic Payments Association
	Since 1974, NACHA–The Electronic Payments Association has served as trustee of the ACH Network, managing the development, administration and rules for the payment network that universally connects all 12,000 financial institutions in the U.S by moving money and information directly from one bank account to another. Financial institutions exchange 24 billion ACH payments valued at $41 trillion annually. Through its collaborative, self-governing model, education, and inclusive engagement of ACH Network participants, NACHA facilitates the expansion and diversification of electronic payments, supporting Direct Deposit and Direct Payment via ACH transactions, including ACH credit and debit payments, recurring and one-time payments; government, consumer and business transactions; international payments, and payments plus payment-related information. Through NACHA’s expertise and leadership, the ACH Network is now one of the largest, safest, and most reliable systems in the world, creating value and enabling innovation for all participants. Visit nacha.org for more information.
	ePayResources
	ePayResources is the second-largest Regional Payments Association member of NACHA – The Electronic Payments Association. For over 40 years we have been providing payments expertise, professional development, and industry leadership to financial institutions and businesses, through education, publications, compliance support, risk management resources, and advocacy. Headquartered in Dallas, we also have offices in Virginia, North Carolina, Florida, and Alabama. Find us at www.ePayResources.org, and follow us on Twitter (@ePayResources_), LinkedIn, and Facebook.
	America Saves
	America Saves, a campaign managed by the nonprofit Consumer Federation of America, uses the principles of behavioral economics and social marketing to motivate, encourage and support low- to moderate-income households to save money, reduce debt, and build wealth. America Saves encourages individuals and families to take the America Saves pledge and organizations to promote savings year-round and during America Saves Week. Learn more at americasaves.org and americasavesweek.org. The Consumer Federation of America is a nonprofit association of more than 270 consumer groups that was established in 1968 to advance the consumer interest through research, advocacy and education. America Saves encourages individuals and families to take the America Saves pledge and organizations to promote savings year-round and during America Saves Week. Learn more at americasaves.org and americasavesweek.org. The Consumer Federation of America is a nonprofit association of more than 270 consumer groups that was established in 1968 to advance the consumer interest through research, advocacy and education.
",,/news/split-save%E2%80%9D-campaign-launches-encourage-american-workers-increase-savings-and-build-wealth,"Thursday, February 23, 2017 - 12:28",en
